{
  "schema_version": "1.0",
  "job_id": "job_example_04",
  "file_id": "file_example_04",
  "status": "needs_review",
  "reason_codes": ["QUALITY_REVIEW_REQUIRED"],
  "policy_id": "preserve-existing-text-v1",
  "target_bytes": 2000000,
  "output_bytes": 1994002,
  "checks": {
    "size_ceiling": "pass",
    "feature_support": "pass",
    "page_structure": "pass",
    "extracted_text": "pass",
    "visual_policy": "unknown"
  },
  "search": {"attempts": 11, "max_attempts": 16, "smallest_tested_bytes": 1610432},
  "limitations": ["Checks do not certify portal acceptance or perfect readability."],
  "next_action": "open_local_review"
}
